{
  "schema_version": "go.dispatch-decision.v1",
  "go_run_id": "a1b2c3d4-e5f6-7890-abcd-ef1234567890",
  "terminal_id": "console_a1b2c3d4",
  "task_id": "TASK-17",
  "route": "refactor",
  "delegated_skill": "/refactor",
  "reasoning_short": [
    "task_type is explicitly refactor: deduplication of existing code",
    "behavior_change_expected is false: no new features or behavior changes",
    "cleanup_only is true: extracting and consolidating duplicate functions",
    "scope is well-defined: single file with clear duplicate helpers"
  ],
  "blocking_preconditions": [],
  "decision_inputs": {
    "behavior_change_expected": false,
    "architecture_unresolved": false,
    "scope_unclear": false,
    "cleanup_only": true,
    "plan_required": false
  },
  "dispatch_status": "routed",
  "decided_at": "2026-04-20T10:01:00Z",
  "notes": "Clear-cut refactor: deduplication of validate_go_contracts.py helpers. No planning or design needed."
}
